Question ID,Question Number,Question Content,Image ID,User ID
a921,1,what is the I.Q. of both of these men combined?,26504,559
a922,2,did he shoot the bird with the gun?,26504,559
a923,1,what are the odds she's on twitter complaining?,249275,559
a924,2,how much does that haircut cost?,249275,559
a925,1,What year is this?,261673,559
a926,2,Where are their husbands?,261673,559
a927,1,is this at a bird show?,80404,559
a928,2,is this in the middle east?,80404,559
a939,1,Where did the lady purchase her umbrella? ,258956,561
a940,2,Where is the lady headed?,258956,561
a941,1,Who owns the kite that is blue?,423107,561
a942,2,What day did this event take place?,423107,561
a943,1,Is this person part of a group?,132710,561
a944,2,Is this a professional skier?,132710,561
a945,1,How many home runs has this person made in this game?,468401,561
a946,2,Does he come from a big family?,468401,561
a947,1,Does this little girl enjoy riding her horse?,71441,561
a948,2,Is the woman in the picture related to the girl?,71441,561
a949,1,Why are they holding ties with numbers on it?,365175,562
a950,2,What is the importance of this photo?,365175,562
a951,1,Who are the people to eachother?,327369,562
a952,2,Why did they not take the pic from one side of the net?,327369,562
a953,1,Is he a professional?,130122,562
a954,2,Did he win?,130122,562
a955,1,Who is this?,186254,562
a956,2,Where is this at?,186254,562
a957,1,Is something wrong with her?,494671,562
a958,2,How did they make the cloud on the wall?,494671,562
a959,1,What genre of movie is the man watching?,11091,563
a960,2,Why is the man using the laptop instead of the other computer?,11091,563
a961,1,What are the people looking at?,230756,563
a962,2,Which of these people has used one of the payphones pictured?,230756,563
a963,1,Why did this person put these toppings on the pizza?,149712,563
a964,2,Is this pizza healthy or unhealthy? Why?,149712,563
a965,1,How many naan has this man sold so far today?,568640,563
a966,2,Where is this man located?,568640,563
a967,1,How many years of experience does this surfer have surfing?,467068,563
a968,2,Has this surfer encountered sharks in the water before?,467068,563
a969,1,How heavy is the typical mountain bicycle?,123552,564
a970,2,In which countries are you allowed to ride on the roof of a bus?,123552,564
a971,1,Is she playing soccer for school or professionaly?,379613,565
a972,2,Has she drank enough water?,379613,565
a973,1,How many hours of instruction and practice does one need to complete a typical beginner's ski class?,522971,564
a974,2,Which are main differences in natural powder (snow) and artificial snow from the skier's perspective?,522971,564
a975,1,Is he not scared?,149842,565
a976,2,Is he at a zoo?,149842,565
a977,1,Are his shoes in his bag?,385972,565
a978,2,Is he on his way to the beach?,385972,565
a979,1,Is that broccoli?,204467,565
a980,2,Why did they take a picture of the child holding the broccoli?,204467,565
a981,1,Do humans take cats to the vet for annual checkups the way that humans go for annual checkups?,294909,564
a982,2,"When is a kitten considered an adult cat, as in, how many months?",294909,564
a983,1,Is this a co-ed soccer team?,198323,565
a984,2,Why isn't the little girl moving more urgently?,198323,565
a985,1,What nutritional supplements should an older woman take to fight hair loss?,547348,564
a986,2,What kind of fabric or substance is used to make an umbrella canopy?,547348,564
a987,1,Are women more likely than men to eat pizza with a fork?,236184,564
a988,2,How do I make a vegan pizza?,236184,564
a993,1,Is the man in the picture a visitor or owner of the home?,299836,567
a994,2,When was the last time this home was decorated?,299836,567
a995,1,Is the woman a professional or amateur player at tennis?,509255,567
a996,2,Is this woman competing or practicing?,509255,567
a997,1,How frequently are these boats used?,27777,567
a998,2,Are these boats used for commercial or private purposes?,27777,567
a999,1,How long have these women known each other?,293853,567
a1000,2,Which woman is the eldest of the trio?,293853,567
a1001,1,What country was this photo taken in?,343908,567
a1002,2,"Does this bathroom belong to an apartment, hotel, or other type of residence?",343908,567
a1009,1,Would this be a vacation spot or a good hiking place?,69874,569
a1010,2,How many people live in this area?,69874,569
a1011,1,I wonder if that bathroom is cleaned by a maid or housekeeping?,510225,568
a1012,2,Where is the countertops to keep all their towels?,510225,568
a1013,1,How long have they been together?,346250,569
a1014,2,What is their best memory from this room?,346250,569
a1015,1,Did the young lady and her dog grow up together?,334616,568
a1016,2,Does the dog like to take pictures?,334616,568
a1017,1,"Is this a commercial, short film, or part of a scene?",562845,569
a1018,2,What country and year is this?,562845,569
a1019,1,Why is he taking a photo in the bathroom?,47054,568
a1020,2,What if someone pop out of that shower?,47054,568
a1021,1,Is there a small corner store around the corner?,281160,569
a1022,2,How often does the woman in the Dove ad sees her picture in different places?,281160,569
a1023,1,Can the elefant paint?,201342,569
a1024,2,How often do they socialize a day?,201342,569
a1025,1,How did he get past that boulder?,571078,568
a1026,2,I wonder if he is having fun or scared? ,571078,568
a1027,1,I wonder what game is he playing?,256385,568
a1028,2,Are they just now getting this game for Christmas?,256385,568
a1029,1,Is this adult the parent to this child?,418517,570
a1030,2,What type of activity is the child doing on the phone?,418517,570
a1031,1,What event is the people watching?,41745,570
a1032,2,How long did it rain outside?,41745,570
a1033,1,Is the bear a gift to a child?,399825,570
a1034,2,How do do you think the bear cost?,399825,570
a1035,1,Is the event in the morning or afternoon?,438795,570
a1036,2,What other tricks will the tainers do with the elephants?,438795,570
a1037,1,Do you know what activity these people are doing?,60350,570
a1038,2,Ate any of these people family members?,60350,570
a1039,1,Why are there handles on his bench?,568974,572
a1040,2,What flavor drink is that from Starbucks?,568974,572
a1041,1,Is that young man tired or upset?,100669,572
a1042,2,Who painted the art on the walls?,100669,572
a1043,1,Does he dream of going to the winter olympics?,565767,572
a1044,2,What kind of camera took this photo?,565767,572
a1045,1,Did she win the match?,58831,572
a1046,2,Where are they going to go eat after competing?,58831,572
a1047,1,"Is he on the ground from catching the Frisbee, or is this a new yoga pose?",102256,572
a1048,2,Do people really watch competitive Frisbee?,102256,572
a1049,1,what type of occasion are the people at?,364455,573
a1050,2,Is the guy in blue in  a relationship with the woman in red?,364455,573
a1051,1,Is the woman taking a picture?,484277,573
a1052,2,Is the woman hard at seeing so she has to hold the phone close?,484277,573
a1053,1,How long has the woman been pulling the man along?,390756,573
a1054,2,Has the man fallen off before?,390756,573
a1055,1,Why is the woman barefoot?,429096,573
a1056,2,Is she waiting for a train or a bus?,429096,573
a1057,1,Which team is winning?,559553,573
a1058,2,Are they playing a scrimmage?,559553,573
b51,1,Who are those flowers that the man is holding for?,115505,8
b52,2,What is the girl on the phone talking about?,115505,8
b53,1,How old the boat?,99678,8
b54,2,What is the string in the water attached to?,99678,8
b55,1,Where is the woman eating the donut?,565513,8
b56,2,What flavor is the donut that the woman is eating?,565513,8
b57,1,Are all the people there related?,42725,8
b58,2,What were the people celebrating?,42725,8
b59,1,What's the weather like?,149036,8
b60,2,Is the man enjoying the activity?,149036,8
b71,1,"Where are they heading that business/formal attire (i.e. dress shirt, tie, with sweater vest) was the dress code?",69432,11
b72,2,Are either one of them excited to be going to their destination or is this a more serious event?,69432,11
b73,1,How long has the couple been engaged and planning their wedding?,344157,11
b74,2,How many guests were invited in total?,344157,11
b75,1,Have either of them been skiing before?,114978,11
b76,2,How long is that ski run from top to bottom?,114978,11
b77,1,Are they both employed at the same place and carpooling together?,226176,11
b78,2,Is the passenger confident enough in the driver's driving ability that he is okay not wearing a helmet?,226176,11
b79,1,How long has the skater been professionally skating?,201929,11
b80,2,Was he the main performer/highlight of the event?,201929,11
b81,1,What profession is in that she gets to wear a tie & suspenders?,441905,12
b82,2,Do you think she was ready for her picture to be taken or was it by surprise?,441905,12
b83,1,Is it dusk or dawn in this picture?,520378,12
b84,2,Is the flower he's showing off a three or two dimentional figure? ,520378,12
b85,1,Is this elephant a newborn or a couple of years old?,294138,12
b86,2,Are these elephants in a zoo or on a reservation preserve for wildlife to live & thrive?,294138,12
b87,1,Is this kid new to the game or has he been playing for a few years?,87602,12
b88,2,"Judging by his concentration, is he about to hit the ball or strike out?",87602,12
b89,1,Do you think that this car belongs to the man under the umbrella or is he just admiring it?,306439,12
b90,2,Is the Alfred Dunhill shop for anybody or does a man have to have a lot of money to shop here?,306439,12
b117,1,Is this truck picking up something or dropping it off?,447795,15
b118,2,Has this truck ever been driven by a woman?,447795,15
b123,1,Does the cat have any siblings?,354517,15
b124,2,Is the TV volume on?,354517,15
b125,1,Which plane is going to land first?,338383,15
b126,2,Which pilot is married?,338383,15
b127,1,What is everyone staring at?,459524,15
b128,2,Why is that person holing a sign that says SLOW?,459524,15
b129,1,Was this a last minute costume?,403357,15
b130,2,Who is he on the phone with?,403357,15
b131,1,Are these guys friends?,298483,17
b132,2,What kind of game are they playing?,298483,17
b133,1,How long will this construction project last?,175047,17
b134,2,Who owns the blue construction hat?,175047,17
b135,1,How long has this person been surfing?,9771,17
b136,2,What did the surfer pack for lunch?,9771,17
b137,1,Are the two people on the right on a date?,369598,17
b138,2,What are the standing person and the person in white talking about?,369598,17
b139,1,Which of these kids has added graffiti to the walls?,143528,17
b140,2,Is this an art gallery or a skate park?,143528,17
b159,1,Are any of these people in the same family?,562845,19
b160,2,Is this a school project?,562845,19
b163,1,Where does this man buy his clothers?,472426,19
b164,2,"Has he read ""War and Peace?""",472426,19
b165,1,Is this woman a vegetarian?,375809,19
b166,2,"Will they ride home on the bus in the background?
",375809,19
b167,1,Did this man have a happy childhood?,276870,19
b168,2,Was the stuffed animal a Christmas present?,276870,19
b169,1,What is the tee ball players name?,240490,21
b170,2,What time of the year is it?,240490,21
b171,1,Is there a cookie shop on this street?,237833,19
b172,2,What is the combined weight of these people?,237833,19
b173,1,What is she pointing at?,169600,21
b174,2,What are they drinking?,169600,21
b175,1,What occassion is it?,285634,21
b176,2,Who is getting the first slice?,285634,21
b177,1,What is mood right now?,307817,21
b178,2,Are there sharks in the water?,307817,21
b179,1,What game is being played?,521416,21
b180,2,Who's winning in the game?,521416,21
b181,1,How did she end up in this situation? ,177840,23
b182,2,Who is helping her? ,177840,23
b183,1,Is the sandwich for her? ,262407,23
b184,2,Is this a happy home? ,262407,23
b185,1,What kind of work is being done on these computers?,441296,22
b186,2,Is the setting some type of laboratory?,441296,22
b187,1,Is that smoke from a dangerous fire? ,227205,23
b188,2,Where is that train headed? ,227205,23
b189,1,Where is this place located? ,250916,23
b190,2,What are these boats used for? ,250916,23
b191,1,Why are the stands so empty?,321389,22
b192,2,Which team is in control of the ball?,321389,22
b193,1,Who designed this art? ,123949,23
b194,2,Is she a celebrity? ,123949,23
b195,1,What country is this skier in?,228783,22
b196,2,Is that a professional skier?,228783,22
b197,1,Are the ropes to stop anyone from using the commode?,557515,22
b198,2,Is this in a rural country?,557515,22
b199,1,What profession is the man with the tie?,563545,22
b200,2,What country is it?,563545,22
b213,1,Why is the guy in the background looking so surprised?,250749,26
b214,2,Is the man in the picture the groom?,250749,26
b217,1,Is she waiting for someone to come?,257670,26
b218,2,How old is the model of her phone?,257670,26
b221,1,Is the snowboarder grinding on the edge of the jump?,43829,26
b222,2,Did they end up landing the trick?,43829,26
b223,1,What is the girl looking at?,408917,26
b224,2,Where did she get the flower?,408917,26
b225,1,Does this man skateboard often?,381509,26
b226,2,What do his peers in the background think of him?,381509,26
b233,1,What types of places are these people travelling to?,406245,27
b234,2,Is this a local or international travel hub?,406245,27
b239,1,What kind of day did this person just have?,39643,27
b240,2,Is this person a traveler or are they in their own home?,39643,27
b245,1,What are they playing?,45524,29
b246,2,What are the rules of the game?,45524,29
b247,1,What kind of food do they serve?,27777,29
b248,2,How old is the boat?,27777,29
b249,1,what celebration is this?,358300,29
b250,2,What organization is this?,358300,29
b251,1,Who took this picture?,2083,27
b252,2,What conversation were these two people just having?,2083,27
b253,1,What is the score?,357799,29
b254,2,What team are they playing ,357799,29
b255,1,Where are the animals coming from?,468891,27
b256,2,What kind of life do these animals live in a day-to-day?,468891,27
b257,1,what forest are they in?,127388,29
b258,2,Are they at a park?,127388,29
b259,1,"Is this person a male, female, or transgender?",477774,30
b260,2,Is this person married or single?,477774,30
b261,1,What caused the need for this piece of machinery?,487571,27
b262,2,How are peoples days disrupted by this machinery?,487571,27
b263,1,Is this activity for kids only or can adults partake in it as well?,115251,30
b264,2,What kind of game is this called?,115251,30
b265,1,Are these girls on a championship team?,559553,30
b266,2,Is this player the star athlete of the team?,559553,30
b267,1,Are these people waiting on a bus or at some kind of festival?,2135,30
b268,2,Are these people nice or rude?,2135,30
b269,1,What are they celebrating?,369931,30
b270,2,whose house are they celebrating at?,369931,30
b275,1,Does God provide food for birds?,381547,31
b276,2,Do you think the company who's disgarded products are mostly found in the seas and rivers be fined for polution and killing sea life?,381547,31
b283,1,Do you love the smell of freshly cut grass?,47548,31
b284,2,What do you think are some of the benefits visiting green open spaces?,47548,31
b285,1,How big is the shower head,139304,33
b286,2,do they have flat irons,139304,33
b287,1,How old it too old for keeping up fake tans?,199469,31
b288,2,"Should women pressure men into getting cosmetic surgery, the same way women feel pressured to look young when they age?",199469,31
b289,1,does it rain a lot,258956,33
b290,2,what was the temp like on that day,258956,33
b291,1,how fast did they drive,530397,33
b292,2,how many people help load it,530397,33
b293,1,how much luggage was under the bus,410173,33
b294,2,how much did the tickets cost,410173,33
b295,1,Do you ever wonder if show-jumingp horses enjoy their job performing at shows?,512838,31
b296,2,Do you think it's right to put down a horse if they break a leg doing stunts as sport. ,512838,31
b297,1,did they ever make it fly ,212887,33
b298,2,did it get lost in the sky,212887,33
b299,1,"When do you think a pregnant woman should stop drinking even the littlest bit of wine, if you think it's ok at all?",204489,31
b300,2,Should wearing a mask in pubs and bars be the rule until covid numbers are way down?,204489,31
b323,1,How many people are in the picture?,70339,37
b324,2,What color is the flowers?,70339,37
b327,1,Where is this picture taken?,189915,37
b328,2,What does the lady on the bench have in her hand?,189915,37
b329,1,What animal is shown here?,195472,37
b330,2,What are the people doing?,195472,37
b331,1,What type of dog is in the image?,461835,37
b332,2,What is the man doing?,461835,37
b335,1,What genre of music is being performed?,211686,37
b336,2,What song is she singing?,211686,37
b337,1,when did this event take place?,90490,39
b338,2,what is the man doing on the computer?,90490,39
b339,1,Is this person performing for someone else not present?,14244,39
b340,2,Is this person a professional?,14244,39
b341,1,Where is this person traveling to?,46942,39
b342,2,Where is this location?,46942,39
b343,1,Who is he talking to on the phone?,150821,39
b344,2,Is the conversation pleasant?,150821,39
b345,1,When was this picture taken?,456987,39
b346,2,Are the women twins?,456987,39
b393,1,How high is this building that the man is standing on?,458914,45
b394,2,Is this a pet bird?,458914,45
b397,1,What could make this player get kicked out of the game?,22482,45
b398,2,How long has this player been playing baseball?,22482,45
b401,1,How high is this wave?,79151,45
b402,2,Is the waves this high all day?,79151,45
b403,1,Why is he taking a picture of the pizza?,460362,45
b404,2,What pizza place is this?,460362,45
b405,1,What type of kite is she flying?,53712,45
b406,2,Where is this place located?,53712,45
b407,1,Should bikers be allowed to ride on the highway opposed to the bike lane?,390756,46
b408,2,Do skateboarders have to follow the rules of the transportation system? ,390756,46
b411,1,What emotion is shown by the child on the right?,229919,46
b412,2,What is an appropriate bedtime for a 3-year old?,229919,46
b413,1,What is the most expensive wine from Italy?,240046,46
b414,2,What pairs best with red wine? ,240046,46
b417,1,What are the steps to tie a tie properly?,363957,46
b418,2,How should a flag be positioned when it is inside of a building?,363957,46
b419,1,How far can horses travel without needing a break?,39141,46
b420,2,What can be used to effectively travel across a body of water in this century?,39141,46
b421,1,How long have the skiiers been skiing?,56023,47
b422,2,Who is the best skier,56023,47
b425,1,Can cows communicate when they are afraid?,262670,47
b426,2,How much do cows eat?,262670,47
b435,1,What beach is this? ,418569,49
b436,2,Are they brothers or friends? ,418569,49
b437,1,What airport is this ?,381107,49
b438,2,What flights are taking off?  ,381107,49
b439,1,How many different bus routes are in this city?,579568,47
b440,2,How much rain falls here every year?,579568,47
b441,1,How many strips are there? ,251502,49
b442,2,Is this a male or female? ,251502,49
b443,1,Who’s son is this lol ? ,150614,49
b444,2,Is this mini league? ,150614,49
b445,1,Who is taking this picture? ,67974,49
b446,2,What restaurant is this? ,67974,49
b453,1,Who was the opponent in tis match?,395178,47
b454,2,What was the score at the end of this match?,395178,47
b463,1,Who is teaching this tennis lesson?,528870,47
b464,2,"How much are tennis lessons?
",528870,47
b465,1,What are the zebras looking at?,365464,52
b466,2,Are the zebras alarmed by what they see?,365464,52
b471,1,What has distracted this couple from watching the kites?,423107,52
b472,2,Why are there different shapes of kites?,423107,52
b475,1,Why are the boys on the floor?,460885,52
b476,2,Are the boys in school?,460885,52
b477,1,Is the skier an experienced skier?,522971,52
b478,2,What is the skier stopped or just starting out?,522971,52
b479,1,Where did the girl get the teddy bear?,203497,53
b480,2,Where did the girl get her shirt from?,203497,53
b481,1,How long have the men been skiing for?,402224,53
b482,2,What country are these men skiing in?,402224,53
b483,1,Is the skater exercising or exercising his dog?,189129,52
b484,2,Is the skater on his way to work or on his way home from work?,189129,52
b485,1,Are the people in the image professional athletes?,405057,54
b486,2,Are they playing on the same team?,405057,54
b487,1,Where did these women get their jackets?,261673,53
b488,2,Where was the phone in the image bought from?,261673,53
b489,1,Where were these horses raised?,544261,53
b490,2,What food is fed to the horses for their competition?,544261,53
b491,1,Is the tennis player playing a game of singles or doubles?,164262,54
b492,2,Is the tennis playing winning or losing?,164262,54
b493,1,What type of flowers are pictured?,147716,54
b494,2,Are the flowers real of fake?,147716,54
b495,1,How long do these women have until they reach their destination?,105633,53
b496,2,What's the name of the building in the background?,105633,53
b497,1,Are the horses wild?,187401,54
b498,2,Is the bigger horse the parent of the smaller horse?,187401,54
b499,1,Where are this person and the horse going?,402762,54
b500,2,Is the person riding in a Western saddle?,402762,54
b501,1,What was the goalie thinking when holding the ball?,99184,55
b502,2,How did the goalie feel in this moment?,99184,55
b503,1,How do you like the surfboard?,571343,55
b504,2,Why do you like surfing?,571343,55
b505,1,Is that a parasol or an umbrella?,134344,55
b506,2,What event were you attending in the photo?,134344,55
b507,1,How is the chocolate donut?,210729,55
b508,2,Where did you purchase the coffee drink?,210729,55
b509,1,Is he playing a game\watching a video on his phone?,145621,56
b510,2,Does he have a reason for being on his phone outside?,145621,56
b511,1,How were the trainers able to make the elephants balance on each other?,438795,55
b512,2,What kind of event was this?,438795,55
b523,1,Really?,364455,57
b524,2,She told you?,364455,57
b527,1,Did the person who took this photo intentionally make it blurry?,431043,56
b528,2,How did the person who took this photo make it blurry; did they shake it or was it just an effect?,431043,56
b529,1,Who is winning?,186753,57
b530,2,Do you need help scoring?,186753,57
b531,1,What country is this man in?,542832,56
b532,2,"Does the man in this image live in this country, or is he just a tourist passing by?",542832,56
b533,1,Why are there so many people surrounding this one surfboard?,556512,56
b534,2,Is there something lurking in the water?,556512,56
b535,1,Are there others behind him?,186254,57
b536,2,Where is he skiing? ,186254,57
b541,1,What Wii game are they playing?,245590,56
b542,2,Are they competing against each other or playing as a team?,245590,56
b543,1,How many kites are in the sky?,123214,57
b544,2,Which kite is higher in the air?,123214,57
b547,1,Where is this located?,362591,57
b548,2,What was the weather like?,362591,57
b553,1,do you believe this is a historical place?,80404,62
b554,2,where do you think this picture takes place?,80404,62
b555,1,what could she be thinking?,81463,62
b556,2,where could she be located?,81463,62
b557,1,do you believe this is pro tennis?,478052,62
b558,2,is she practicing or has an opponent?,478052,62
b561,1,do you think this man is a doctor?,126552,62
b562,2,is he in a hospital?,126552,62
b563,1,where are these people located?,366897,62
b564,2,are they having class?,366897,62
b579,1,What is this boy's name?,446557,66
b580,2,Does this boy play any sports other than baseball?,446557,66
b583,1,Is the man and the boy related?,414422,66
b584,2,How old are the man and the boy?,414422,66
b585,1,Does this woman live in this house that she's pictured in?,305600,66
b586,2,Did this woman break off the fridge door or was it already broken off?,305600,66
b587,1,What countries do you think these women represent?,44724,67
b588,2,Who do you think is going to win the game?,44724,67
b589,1,Is this surfboard sturdy?,518966,66
b590,2,How much did this surfboard cost?,518966,66
b591,1,What do you think the horses are thinking in this picture? ,239928,65
b592,2,I wonder if all horses enjoy humans sitting on them. ,239928,65
b593,1,Who owns this umbrella?,236350,66
b594,2,Is the umbrella functional?,236350,66
b595,1,Do you think he looks safe riding in that lane?,385972,67
b596,2,Where do you think he is headed?,385972,67
b597,1,Why is the clock placed behind the chair? ,15906,65
b598,2,Why are a lot of chairs placed beside a window? ,15906,65
b599,1,Do you think this guy is an experienced rider?,251210,67
b600,2,I wonder if he's considered a professional? (sponsored?),251210,67
b601,1,Why is this family so engaged with what’s on their tv? ,403743,65
b602,2,I wonder why this family all have similar facial expressions at what they see.,403743,65
b603,1,Do you think that green paint or powder is safe for the elephant?,50583,67
b604,2,"I wonder if the elephant has ever lashed out or became agressive with the trainer, or other people?",50583,67
b605,1,Why is this elephant looking like he’s so bored?,83468,65
b606,2,Why is the lady in the picture the only one who looks like sees enjoying herself? ,83468,65
b607,1,Do you think she's talking to someone like her boyfriend?,484277,67
b608,2,I wonder if she is at work and sneaking a call to somebody.,484277,67
b613,1,Why does this skier appear to be walking up the slope of this mountain?,288486,68
b614,2,What mountain is this skier on?,288486,68
b617,1,Why are all the trees pointed at the top? ,480026,65
