Question ID,Question Number,Question Content,Image ID,User ID
a1,1,Is is a renewal of vows rather than a wedding based on lack of traditional topping and informal garb?,114786,458
a2,2,Is it a chocolate cake?,114786,458
a3,1,what wine would pair well with this pizza?,149712,458
a4,2,Is this a homemade pizza or frozen pizza?,149712,458
a5,1,Are these tennis players off the field?,58831,458
a6,2,where is this tennis event taking place?,58831,458
a7,1,What camera tools can be used to improve the quality of this image?,172501,458
a8,2,Who is she looking at? A friend?,172501,458
a9,1,How long has she been married?,521416,458
a10,2,What are her favourite TV shows?,521416,458
a11,1,Which month of the year do you think it is in this photo?,29821,459
a12,2,At what time of day was this photo taken?,29821,459
a13,1,How warm is the jacket that the man on the left is wearing?,563545,460
a14,2,What is the woman on the right going to eat for breakfast this Saturday?,563545,460
a15,1,In which direction will the bird fly?,80404,459
a16,2,How high off the ground is the man on the balcony?,80404,459
a17,1,Which member of the audience currently needs to use the restroom?,473616,460
a18,2,Where is the tennis player going to walk his dog this evening?,473616,460
a19,1,How many times did the man in the picture change his tie before deciding on the one he is wearing?,141386,460
a20,2,What is the temperature of the room the man is standing in?,141386,460
a21,1,How long ago has it been since this giraffe has seen its mother?,380500,460
a22,2,Which person in this photo is craving a cheeseburger?,380500,460
a23,1,How deep is the water?,534866,460
a24,2,Which room in his home is this man going to sleep tonight?,534866,460
a25,1,Why does one person have a longer board than the others?,6332,459
a26,2,Which individual is more than likely the instructor or leader?,6332,459
a27,1,How do you think this person felt at the time this photo was taken?,116968,459
a28,2,Is this individual ending or beginning their day in the water?,116968,459
a29,1,"Based on the picture, what is the approximate temperature?",105633,461
a30,2,What shoe brand is the girl with the red hair wearing?,105633,461
a31,1,How many flights a day do you think this plane flew?,316474,459
a32,2,How long do you think this plane has been in disrepair?,316474,459
a33,1,How does the sun affect the height the kites may fly?,546703,461
a34,2,Does the color of the kite affect the overall score?,546703,461
a35,1,Is a vegan lifestyle better for young children? ,103251,461
a36,2,Should parents be worried about potential hazards in the home when having children?,103251,461
a37,1,Should more teams have kids' programs for young fans?,446557,461
a38,2,Should the size of the baseball be smaller?,446557,461
a39,1,Should motorcycles have their own designated parking spots?,54286,461
a40,2,Should parking spaces be more spread apart?,54286,461
a41,1,What do you think the man is being interviewed about?,322835,462
a42,2,Do you think this is an intense conversation?,322835,462
a43,1,Do you think these people still know each other?,39708,462
a44,2,How old do you think the people are in this photo?,39708,462
a45,1,What do you think is going on in this photo?,343908,462
a46,2,Do you understand this photo?,343908,462
a47,1,What do you think this lecture is about?,427169,462
a48,2,What college do you think this picture was taken in?,427169,462
a49,1,How do you think this guy feels looking in the mirror?,259366,462
a50,2,Why do you think this photo was taken?,259366,462
a51,1,What do you think everyone is looking at?,459524,463
a52,2,Are cars not allowed on the street in this image?,459524,463
a53,1,What country is this image from?,413923,463
a54,2,How hot do you think it is outside in this image?,413923,463
a55,1,What time of day is it?,390756,463
a56,2,Is there a beach nearby?,390756,463
a57,1,How old do you think the children are in this picture?,340494,463
a58,2,Which Olympics do you think the boy's shirt is from?,340494,463
a59,1,How long do you think the boy in the green shirt has been playing tee ball?,240490,463
a60,2,Was this picture taken before practice or before a game?,240490,463
a61,1,What might the girl in the picture be thinking about?,271633,464
a62,2,Do you think these children are homeless or just hanging out?,271633,464
a63,1,What filled you with joy as a kid?,204467,464
a64,2,What activities did you like to do with your parents as a child?,204467,464
a65,1,Were phones created to distract us from what we could truly become?,484277,464
a66,2,how can we keep a balance of technology use and self care in our daily lives?,484277,464
a67,1,Do you prefer dogs or cats as pets?,250400,464
a68,2,What do your daily activities consist of?,250400,464
a69,1,What gives you the feeling of nostalgia?,426829,464
a70,2,What are some memories you cherish the most when growing up?,426829,464
a71,1,Is this a rave?,143528,465
a72,2,shouldn't these kids be in school ,143528,465
a73,1,What foods are part of an elephant's diet?,294138,466
a74,2,How tall is the average elephant?,294138,466
a75,1,Would that bear be a good gift for children?,399825,466
a76,2,Which toy of the two would a kid prefer?,399825,466
a77,1,Did this man attend college?,472426,466
a78,2,Where was this picture taken?,472426,466
a79,1,is he tired of standing there,578023,465
a80,2,I don't see the ball,578023,465
a81,1,Where is the man in the picture going?,24980,466
a82,2,How many people were inside of that train?,24980,466
a83,1,What city is this picture located at?,107705,466
a84,2,What type of stores are inside the building?,107705,466
a85,1,Is this a circus,438795,465
a86,2,Are the animals happy,438795,465
a87,1,How many people do you think attended this wedding?,344157,467
a88,2,What do you think the flavor of the cake is?,344157,467
a89,1,Why do you think this dog is interested in this movie?,28878,467
a90,2,What dog breed do you think this is?,28878,467
a91,1,How long do you believe this dad was away from his family?,418517,467
a92,2,Do you think this little girl is the only child?,418517,467
a93,1,What rank do you think this tennis player is? ,509255,467
a94,2,What do you think about her tennis outfit?,509255,467
a95,1,What do you believe this man is thinking when he looks at this car?,306439,467
a96,2,What country do you think this image is from?,306439,467
a97,1,Is this a house,369452,465
a98,2,what does that painting mean,369452,465
a99,1,what game is he playing,256385,465
a100,2,Is this an apartment,256385,465
a101,1,Why is the women dressed so neatly when attended to a horse?,423247,468
a102,2,What's the horse's name?,423247,468
a103,1,What's the woman drinking?,314392,468
a104,2,What year was this photo taken?,314392,468
a105,1,Where was this photo taken?,375939,468
a106,2,Has the photo been edited?,375939,468
a107,1,How old is the girl?,69578,468
a108,2,Where was the photo taken?,69578,468
a109,1,What happened to the fridge?,305600,468
a110,2,Why is the counter so cluttered?,305600,468
a111,1,What do you think they are discussing?,468518,471
a112,2,Who took this picture?,468518,471
a113,1,What restaurant are they heading to?,346250,471
a114,2,How long have they been together?,346250,471
a115,1,Does this kid have siblings?,259652,471
a116,2,What country was this photo taken in?,259652,471
a117,1,How old is this giraffe?,110084,471
a118,2,Do giraffes know how to jump?,110084,471
a119,1,Do you think they are still alive today?,229919,471
a120,2,Who's their mother's favorite of the two?,229919,471
a121,1,Is she old enough to drink?,294325,473
a122,2,How many calories do you think is in her beer?,294325,473
a123,1,Can you tell the age of this horse?,402762,473
a124,2,How tall do you think the person is?,402762,473
a125,1,How long do you think she’s been cooking?,85235,473
a126,2,Is she head chef?,85235,473
a127,1,Do you think this bathroom is small?,510225,473
a128,2,How long would it take to clean this bathroom?,510225,473
a129,1,Who is the photographer?,47054,473
a130,2,What do you imagine the colognes smell like?,47054,473
a131,1,What is she looking at on her phone,122631,474
a132,2,How many people were with her,122631,474
a133,1,What is the person in the pink hat saying,71441,474
a134,2,What kind of event in going on here,71441,474
a135,1,Do they feel cramped sitting at the table together,130834,474
a136,2,Is there a third person that is sitting with them,130834,474
a137,1,How skilled are they at skiing,389133,474
a138,2,Are they close to the bottom of the area they are skiing down,389133,474
a139,1,Is this picture supposed to evoke a sad feeling,494671,474
a140,2,How long did it take to set up this picture,494671,474
a151,1,Are these children brothers with different leisure interests?,460885,476
a152,2,Are these children at a daycare or camp of some kind?,460885,476
a153,1,Are these teenagers eating out before their prom night?,460575,476
a154,2,Are these teenagers talking about the roll on the guy's plate or the chicken?,460575,476
a155,1,Is this woman in a bakery or donut shop?,565513,476
a156,2,Is this woman enjoying the doughnut or repulsed by it?,565513,476
a157,1,Is the batter going to hit the ball?,35552,476
a158,2,What do you think the weather is in this picture,35552,476
a159,1,Is this a group of friends at a party or place of work?,186753,476
a160,2,What game are these people playing?,186753,476
a161,1,Which mountain do you think would be the most fun to ski down?,186254,477
a162,2,How do skiers practice in the summer?,186254,477
a163,1,How would you feel about your child wanting to snowboard at a young age?,565767,477
a164,2,"Should snowboarders wear helmets, even if not going down a large distance?",565767,477
a165,1,Is there a strong emotional connection between humans and their pets?,294909,477
a166,2,"Because cats can jump so high, are items in a cat owner's home more breakable?",294909,477
a167,1,What occasion are these people celebrating?,547348,478
a168,2,How might the weather impact this person's mood?,547348,478
a169,1,Where do you think the suitcases are being thrown?,202076,477
a170,2,Do people who work on ships have to fit a specific fitness requirement?,202076,477
a171,1,Is this a family-friendly event or a family event?,358300,478
a172,2,How many pizzas would you need to order to feed a crowd of double this size?,358300,478
a173,1,Which body part hurts to tattoo the most?,494208,477
a174,2,Is it easier to wear glasses or contacts?,494208,477
a175,1,Is red wine or white wine more popular?,364455,478
a176,2,Is this a political fundraiser.,364455,478
a177,1,Which cities could have a similar skyline?,123552,478
a178,2,How might climate change impact this skyline?,123552,478
a179,1,How many strikes did the player hit?,577953,479
a180,2,What happens after you catch a baseball?,577953,479
a181,1,Do you like sugar with your tea?,308575,479
a182,2,Is it date night?,308575,479
a183,1,What time of year is best to  kites?,489263,478
a184,2,Is it a good idea to fly kites at the waters edge?,489263,478
a185,1,How fast can horses run?,155058,479
a186,2,Do the horses enjoy being ridden?,155058,479
a187,1,What game can you play on the wii?,60350,479
a188,2,Are family game nights enjoable?,60350,479
a189,1,Who is the current best tennis player?,500005,479
a190,2,How har can a tennis ball be hit?,500005,479
a191,1,What animal does the teddy bear so have symbolize?,276870,480
a192,2,Is this exactly a police officer?,276870,480
a193,1,Is the skater class to water?,132710,480
a194,2,What kind of game is this?,132710,480
a195,1,What is the wines trying to help the baby out with,326048,480
a196,2,What kind of facial expression is the woman having?,326048,480
a197,1,What is the name of the bank snack?,107147,480
a198,2,Is this s delivered package already?,107147,480
a199,1,What season of this year could this be?,200796,480
a200,2,What kind of event is this?,200796,480
a211,1,What do you think the weather is like where the picture takes place?,258956,482
a212,2,What do you feel like the woman is looking at?,258956,482
a213,1,What kind of event do you feel the man is going to?,466445,482
a214,2,Which relative do you think took this picture?,466445,482
a215,1,How long do you think this rider has been professionally riding for?,23253,482
a216,2,Do you think his back hurts?,23253,482
a217,1,Does this child ride a skateboard often?,138100,482
a218,2,Do you think this child learned skating from a family member?,138100,482
a219,1,Do you think this child has flown a kite before?,375809,482
a220,2,How cold do you think it is?,375809,482
a221,1,How likely do you think he will hit a home run?,87602,483
a222,2,Is he happy playing this sport or just doing it to please his parents?,87602,483
a223,1,Is this an halloween party?,468529,483
a224,2,Did rapture happened and took everyone at the party but left the bartender?,468529,483
a225,1,Did someone force him to sit outside?,514131,483
a226,2,Is he contemplating running away from home?,514131,483
a227,1,Are the people on the beach genuinely happy or forced to be out there by aliens?,404964,483
a228,2,Are ghost flying the kites?,404964,483
a229,1,Is the dog a great swimmer?,103581,483
a230,2,Is the guy rowing the canoe a dog lover?,103581,483
a231,1,Why do people enjoy flying kites?,248797,484
a232,2,Is the beach a place that brings you joy?,248797,484
a233,1,What was your favorite wii game to play?,405121,484
a234,2,Do you think video games are harmful in anyway?,405121,484
a235,1,Do you like the rain? ,5094,484
a236,2,Why do you think the design of umbrellas hasn't changed much?,5094,484
a237,1,Do you prefer to tell time digitally or the old fashioned way?,356938,484
a238,2,"Time isn't real, do you agree?",356938,484
a239,1,Have you ever tried rollerskating?,188009,484
a240,2,"If you ever roller-skated, rode a bike/motorcycle do you always wear a helmet? ",188009,484
a241,1,Why is the man recording these women? ,562845,485
a242,2,Is the man in the background supposed to be a part of the video?,562845,485
a243,1,Did he just hit a home run? ,468401,485
a244,2,How many teams has he played for?,468401,485
a245,1,Is this lady going to work?,376731,485
a246,2,what part of the country is she currently in?,376731,485
a247,1,How important is motorcycle safety?,226176,485
a248,2,Are they going to work?,226176,485
a249,1,Did they get dressed up for a picture or video?,293853,485
a250,2,What are they symbolizing?,293853,485
a251,1,How popular is skiing in the United States?,522971,486
a252,2,I wonder where she is skiing?,522971,486
a253,1,Why are the people in this image huddled in a crowd?,41745,486
a254,2,Are these people possibly protesting?,41745,486
a255,1,When was the image taken?,168083,486
a256,2,Are they siblings or romantic partners?,168083,486
a257,1,What happened right before this picture was taken?,127388,486
a258,2,Who took the photo?,127388,486
a259,1,How popular is tennis?,508749,486
a260,2,Does that Dell laptop still work?,508749,486
a261,1,How cloudy is it that day?,467068,487
a262,2,What does the water sound like?,467068,487
a263,1,Where is his family?,100669,487
a264,2,What does he eat for dinner?,100669,487
a265,1,Where are they going?,298008,487
a266,2,Where did he get his shoes?,298008,487
a267,1,Does his feet burn?,385972,487
a268,2,Is he in Los Angelas?,385972,487
a269,1,Are they siblings?,198323,487
a270,2,Are they hydrated?,198323,487
a271,1,what is the average number of goals scored per soccer games at the collegiate level? ,379613,488
a272,2,Did you know student athletes suicide rate is higher than the normal student in college?,379613,488
a273,1,About how much money do you think the company Apple makes a year?,366925,488
a274,2,Are these men part of a bowling league?,366925,488
a275,1,How many tennis players does Gatorade sponsor altogether?,402916,488
a276,2,Why do most people chose to watch women's tennis over men's tennis?,402916,488
a277,1,Do average kids ages 5-7 prefer kite flying over playing baseball?,517362,488
a278,2,At what age do you think children have the right to decide they are a transgender?,517362,488
a279,1,Has the PS5 replaced the WII games in most homes?,443673,488
a280,2,Will WII games help fight the obesity rate here in America?,443673,488
a281,1,What can a kite represent?,520378,489
a282,2,What are popular places to fly kites?,520378,489
a283,1,Does he like computers?,201940,490
a284,2,Is he a musician?,201940,490
a285,1,"How have weddings (customs, traditions, etc.) changed over the years?",110596,489
a286,2,Has the ongoing emancipation of women's rights impacted modern-day marriage in any way?,110596,489
a287,1,Where is this place located?,369777,490
a288,2,Is this set up in a tent?,369777,490
a289,1,What kind of sandwich is this person cooking?,257773,490
a290,2,Was this picture taken at the back of the food kitchen?,257773,490
a291,1,Is the lady in the photo pregnant?,441108,490
a292,2,What is the reaction of the horse?,441108,490
a293,1,How can humans and animals coexist peacefully and satisfactorily? ,201342,489
a294,2,Which region in the world contains the majority of the elephants?,201342,489
a295,1,Do you like trains?,227205,490
a296,2,Where is this train going to?,227205,490
a297,1,Are families spending less quality time together than the previous decade?,126047,491
a298,2,How can living room furniture be arrange to facilitate conversation?,126047,491
a299,1,"Is a woman's willingness, or desire, to clean, an important component in her desirability?",15897,489
a300,2,Why do some people find comfort through non-living things?,15897,489
a301,1,Should coworkers drink together outside of work?,466890,491
a302,2,What kind of styling products can be used for spiky hairstyles?,466890,491
a303,1,How has men's' fashion influenced women's'?,441905,491
a304,2,Can ties be a meaningful Fathers' Day gift?,441905,491
a305,1,"How has gaming technology changed over the decade?
",426776,491
a306,2,How are female gamers different from males?,426776,491
a307,1,Are there any countries (or places) that regularly employ the use of horses as transportation?,290136,489
a308,2,Would the replacement of cars with horses be better for the environment or worse?,290136,489
a309,1,How is climate change affecting skiing?,253334,491
a310,2,Is skiing an accessible sport?,253334,491
a311,1,Is this her second or third slice of pizza?,236184,492
a312,2,Is this store in her office building or far away from her office?,236184,492
a313,1,Does he enjoy a lot of spicy foods?,340220,492
a314,2,Did he drop that fork on the floor before placing it on the counter?,340220,492
a315,1,What's over the next hill?,402224,492
a316,2,Did it snow today or yesterday?,402224,492
a317,1,Is this park in the United States?,102256,492
a318,2,Are there any dogs in the area?,102256,492
a319,1,Does this house have any hidden treasures?,539571,492
a320,2,Is the television over 40 inches?,539571,492
a321,1,Is he running a race?,251210,493
a322,2,Why is he riding this way?,251210,493
a323,1,Why is the hurt on the road?,429065,493
a324,2,Is this not a wrong position for this?,429065,493
a325,1,Is it a father and a son,327369,493
a326,2,Are the playing together,327369,493
a327,1,Why is she smiling?,323448,493
a328,2,Why is she alone?,323448,493
a329,1,Are this for children?,413903,493
a330,2,What are the for?,413903,493
a331,1,Where is the man going on the bike?,230756,494
a332,2,What did the woman sitting down eat for breakfast?,230756,494
a333,1,Where did the woman by the sink buy her sweater?,2083,494
a334,2,Why is the window opened?,2083,494
a335,1,How old is this elephant?,365703,494
a336,2,Does the elephant have any siblings?,365703,494
a337,1,Where is this bench located? ,568974,494
a338,2,What Starbucks drink is in the cup?,568974,494
a339,1,What are the men skateboarding names? ,301207,494
a340,2,Does the guy with 2 white kneepads have a sister?,301207,494
a341,1,Where are these people going?,65195,495
a342,2,What types of food do elephants eat?,65195,495
a343,1,What types of jokes do women enjoy?,369931,495
a344,2,What are the right kinds of food for women?,369931,495
a345,1,What type of equipment do you need to enjoy skiing?,189280,495
a346,2,What kind of jobs are available for women skiiers?,189280,495
a347,1,How do you retrieve a kite that has flown away?,23951,495
a348,2,Is it safe to fly a kite at night?,23951,495
a349,1,How much does it rain in Japan?,146313,495
a350,2,Where can I purchase a clear umbrella?,146313,495
a351,1,How did this happened?,69874,496
a352,2,Where did it come from?,69874,496
a353,1,Who is this tennis player?,395178,496
a354,2,What is her ranking in tennis?,395178,496
a355,1,Where are they located?,534633,496
a356,2,What is their mission to do?,534633,496
a357,1,What is this?,557515,496
a358,2,What are they going to do with it?,557515,496
a359,1,Where are the elephant?,329118,496
a360,2,What type are they?,329118,496
a361,1,What are the man and the woman discussing?,252952,498
a362,2,What country are the people in?,252952,498
a363,1,What kinds of books do you think they read?,107518,498
a364,2,Which one do you think knits?,107518,498
a365,1,How many times a day do you think they run from predators?,365464,498
a366,2,How many mates do zebras have during one life?,365464,498
a367,1,How busy can the roads get here?,281160,498
a368,2,What are the most popular jobs amongst the people here?,281160,498
a369,1,Why are babies so strong?,53897,498
a370,2,How fast do babies teeth grow?,53897,498
a371,1,I wonder if what she is about to eat is healthy?,388662,499
a372,2,I wonder how she is going to feel after she finishes the meal?,388662,499
a373,1,Which picture do you think would encourage you or inspire you?,521867,499
a374,2,How do these pictures make you feel?,521867,499
a375,1,I wonder what they are looking at?,68287,499
a376,2,Why are the two men wearing shades?  ,68287,499
a377,1,What are they happy about?,296233,499
a378,2,Where are they from?,296233,499
a379,1,What is this man doing?,461835,499
a380,2,I wonder what he is thinking about?  ,461835,499
a381,1,What is the relationship of the women in the picture?,164680,500
a382,2,What city are they in?,164680,500
a383,1,Why does he lift his leg to throw?,22482,500
a384,2,Why does he have the number 75?,22482,500
a385,1,What ocean is this in?,338544,500
a386,2,What country is this image from?,338544,500
a387,1,What mountain is he sliding down?,20711,500
a388,2,How long does it take to learn to ski?,20711,500
a389,1,Why are there two images here?,559553,500
a390,2,Why are they wearing the same uniform?,559553,500
a391,1,Are these two men friends? ,237833,501
a392,2,What town is this? ,237833,501
a393,1,What was the point of killing this exotic bird? ,26504,501
a394,2,What country is this in? ,26504,501
a395,1,Is this person skiing with friends? ,288486,501
a396,2,Where is this located? ,288486,501
a397,1,In what year was this photo taken? ,249275,501
a398,2,Is this person a teenager? ,249275,501
a399,1,Is it safe to skateboard in crocs? ,461815,501
a400,2,Who took this photo? ,461815,501
a401,1,Which rag on the chair came from europe?,11091,502
a402,2,what is his favorite show?,11091,502
a403,1,which boy went to hawaii on vacation?,9895,502
a404,2,how are their eating habits?,9895,502
a405,1,Which child got diagnosed with childhood ADHD?,229827,502
a406,2,what is greens favorite show?,229827,502
a407,1,How does tennis help cardiovascular health?,398099,502
a408,2,Where is the best tennis court in the world?,398099,502
a409,1,What is the hiding girl thinking?,547764,502
a410,2,Are twins more prevalent in todays society?,547764,502
a411,1,Is it possible for the animal to stand on its tiptoes?,50583,503
a412,2,How many years does it take to train an animal in the circus?,50583,503
a413,1,Is excelling in sports an innate ability?,36098,503
a414,2,How much training does it take to excel at a sport?,36098,503
a415,1,How many years of training does it take to do well in this sport?,331271,503
a416,2,How does one train in this sport?,331271,503
a417,1,What type of training do you have to do to excel in this sport?,159554,503
a418,2,How long would you have to train to do to do well in this sport?,159554,503
a419,1,What type of weather would be ideal to train for this activity?,390935,503
a420,2,How would you train for this activity?,390935,503
a421,1,Where did you say that beach was?,335027,504
a422,2,What do you mean this isn't a skate board?,335027,504
a423,1,Do you think the jacket fits him?,36439,504
a424,2,Did we forget the rest of the costume?,36439,504
a425,1,Is that the leader of the parade?,477774,504
a426,2,Is this guy for real?,477774,504
a427,1,Why are the police blocking traffic?,366414,504
a428,2,Is going to allow us to cross the street?,366414,504
a429,1,Do you still think that they are coming to the party?,168488,504
a430,2,Why did you pick such a lousy day to do this?,168488,504
a431,1,How many years has he trained for tennis?,262529,505
a432,2,What company sponsored him?,262529,505
a433,1,What country do you think this picture is from?,494240,505
a434,2,Can you name the type of bird this is?,494240,505
a435,1,What part of the navy is this?,579533,505
a436,2,Where do you think these people are stationed?,579533,505
a437,1,Do you think the boy enjoyed his trip at the zoo?,435011,505
a438,2,How many giraffee are left in the wild now?,435011,505
a439,1,Which teams are playing?,329563,505
a440,2,Have you been to a baseball game?,329563,505
a441,1,When was this tournament?,247545,506
a442,2,"At this point, how close was the game (in points)?",247545,506
a443,1,Who is the man talking to?,100300,506
